<?xml version="1.0" encoding="UTF-8" ?>
<!DOCTYPE employees SYSTEM "format.dtd">
<employees facility="clinic"
           xmlns:xsi="http://www.w3.org/2001/XMLSchema-instance"
           xsi:noNamespaceSchemaLocation="data2.xsd">
    <employee>
        <name>Ivan</name>
        <lastName>Ivanov</lastName>
        <patronymic>Ivanovich</patronymic>
        <position>surgeon</position>
        <department>surgery</department>
        <workExperience>20</workExperience>
    </employee>
    <employee>
        <name>Natalya</name>
        <lastName>Ivanova</lastName>
        <patronymic>Igorevna</patronymic>
        <position>nurse</position>
        <department>ambulance</department>
        <workExperience>25</workExperience>
    </employee>
</employees>